"Timestamp","What is your gender?","What is your ethnicity / race?","Do you currently identify as LGBTQ+?","What is your age?","How did you hear about this survey?","What 5 - 15 key words would you currently associate with your artwork, subject matters, mediums etc? Separate with commas. (i.e. figurative, muted color, social issues, air brush, interdisciplinary etc.)","Are there any questions you would add, remove or change in this section?","How much of a priority was exhibiting your work this past year?","How many group exhibitions were you in this past year?","How many solo exhibitions did you have this past year?","How many exhibitions did you apply for this past year?","Roughly how much did you pay total in application fees for exhibitions this past year?","What kinds of exhibition spaces / venues did you show in this past year? (check any that apply)","Roughly how many times was your work written about in an online or print publication this past year? ","Roughly how many times was your work featured / re-posted by someone else on social media this past year?","How did your exhibition opportunities this year come about? (check any that apply)","How many shows / events / books etc. did you help organize this past year? (not related to job duties)","Did you have official gallery representation this past year? (listed officially on their website)","Were you given any kind of legal paperwork (contract, loan agreement, tax document etc.) by a gallerist, art dealer or collector this past year?","How much of a priority was applying for residencies or grants this past year?","How many residencies did you apply for this past year?","How many residencies did you attend this past year?","How many grants did you apply for this past year?","How many grants did you receive in total this past year?","Roughly how much did you receive in total grants this year?","Are there any questions you would add, remove or change in this section?","How much of a priority was selling your art or art-related work this past year?","Who did you sell art or art-related work to this past year? (check any that apply or add other)","How did you make art-related sales this past year? (check any that apply)","Roughly how much money did you make from art-related sales this year?","What kinds of work did you sell this past year? Separate with commas. If none, leave blank. (i.e. paintings, etchings, t-shirts etc.)","How would you rate the overall treatment you received from the collectors / buyers you worked with this past year?","Did you use any of the following platforms to make sales this past year? Check any that apply.","How much of a priority was having studio visits for you this past year?","Roughly how many studio visits did you have this past year?","Whom did you have one or more studio visits this past year? (check any that apply or leave blank if none)","How did your studio visits this year come about? (check any that apply or leave blank if none)","Are there any questions you would add, remove or change in this section?","How much of a priority was social media use for you / your studio this past year?","Roughly how often did you create Facebook posts related to your artwork or exhibitions this past year?","Did you use Facebook more or less this past year than the previous year?","Roughly how often did you create Instagram posts related to your artwork or exhibitions this past year?","Did you use Instagram more or less this past year than the previous year?","Did you pay for any social media promotion this past year? If so did it have a noticeable positive impact?","How well do you feel your primary social media platform served you / your studio practice this past year? (10 being the best possible score)","What aspects of your primary social media platform did you think worked well for you / your studio this past year? (i.e. public likes, follower counts, order of posts in feed etc.)","What aspects of your primary social media platform did you think worked poorly or were problematic for you / your studio this past year?","Did you maintain a personal art / studio website this past year (i.e. www .yourname .com etc.) that was not on a social media platform?","Did you maintain a personal art / studio website at any point during 2016?","What other resources did you use frequently this past year for finding art-related content? (check all that apply)","Are there any questions you would add, remove or change in this section?","What type of work space did you use this past year? (check any that apply)","Roughly how large is your current personal work space?","How much did you pay for your most recent month of studio space rent?","On an average week how many days did you get to work in your studio this past year? (counting half or partial days)","On an average studio day how much time did you spend in your studio space? (working / reading / thinking etc.)","Are there any questions you would add, remove or change in this section?","What types of jobs did you have this year?","Did you apply for or receive unemployment benefits or food stamps this year?","Roughly how many jobs did you apply for this year?","Roughly how much did you make in job-related income this year? (not including art sales)","Did you claim any art / studio expenses on any tax return filed this past year?","Are there any questions you would add, remove or change in this section?","What is your highest level of education? Choose the most specific / appropriate answer.","Are you currently a student?","If you are currently a student what school do you attend?","List any past degrees you've completed. Include the schools and graduation years. Separate with commas and periods. (i.e. BS in Psychology, Iowa State, 2009. MFA in Digital Media, UC Santa Cruz, 2012 etc.)","How would you rate your educational experience overall? (1 being poor, 10 being exceptional)","Roughly how much do you currently owe in student loans? (if currently a student estimate loans upon graduation)","Roughly how much was your most recent monthly student loan payment?","Are there any questions you would add, remove or change in this section?","What neighborhood and city do you currently live in? Separate with commas. (i.e. Korea Town, Los Angeles)","What neighborhood and city did you live in at the end of 2016?","What are the most important benefits of your current city or neighborhood? Separate with commas. (i.e. diverse population, affordability, safety, good weather)","Are there any questions you would add, remove or change in this section?","How much of a priority was visiting galleries / museums for you this past year?","Roughly how many gallery receptions / openings did you attend in total this past year?","Roughly how many times did you attend an art fair or biennial this past year?","How many new galleries can you personally think of that opened this past year in your city? (don’t overthink it)","How many galleries can you personally think of that closed this past year in your city? (don’t overthink it)","Are there any questions you would add, remove or change in this section?","What schools did you teach for this past year? (optional)","How many classes did you teach in your most recent semester?","How many campuses did you teach at in your most recent semester?","How would you rate the overall work environment of your school or schools this past year?","Were you a part of a union this past year?","What additional duties aside from teaching did you perform for your school or schools this past year? Separate with commas, if none leave blank.","Were you explicitly paid for these extra duties?","Are there any questions you would add, remove or change in this section?","Roughly how long did you spend filling out this survey?","Do you feel you were generally welcomed and embraced by the art world this past year?","Do you feel that you or your career may have been significantly negatively effected by any type of discrimination or bias this past year?","Are there any arts institutions, galleries etc. that you would like to anonymously cite for outstanding service to artists or communities this past year? Separate by commas, if none leave blank.","Are there any arts institutions, galleries etc. that you would like to anonymously cite for harming artists or communities this past year? Separate by commas, if none leave blank.","Are there any questions you would add, remove or change in this final section?","Are there any sections you would add or remove completely from this survey?","Do you have any final thoughts regarding this survey?","","","","","",""
"2019/08/06 5:24:58 PM PDT","M","W","Prefer not to say","30 - 39 years old","Other artist / peer","Acid, techno, ink","Maybe","I was not important","1 - 2","0","0","$0","Artist run spaces","0","","Other artist peers","0","No","No","","0","0","0","0","$0","Yes","I was not important","Online fans","Band camp ","$250 - $500","Tapes, zines ","Generally positive","Bandcamp ","I was not important","0","","","Maybe","It was somewhat important","Never","","1 - 3 times per week","","I did not pay for any promotion this year","","","","Yes and I plan to continue","","Instagram","Sorta","Completely mixed up with living space","A desk / table etc. (less than 80 square feet)","$0","3","10 hours or more","Yeah ","Crafts related ","No","0","$1 - $5,000","No","Yes","BFA","No","","Psu","","$0","$0","Yerp","Lafayette ","Lafayette ","","Yes","I was not important","1 - 2","1 - 2","0","Not sure / don’t recall","","","","","","","","","","20 - 30 minutes","Not sure / hard to say","I don’t believe so","Myself","Everyone else","No","","No","No","Hopeful the world will still exist ","Access to Peace / Quiet;Convenient Access to Nature;Affordability / Availability of Housing","Too long by 11 - 25 questions","Not sure / hard to say.","Yes"
"2019/08/09 2:38:06 PM PDT","Female","White","No","30 - 39 years old","Other artist / peer","Painting, collage, photography, memory, loss, layering, transparency, visibility ","No","It was somewhat important","1 - 2","0","0","$0 - 25","Artist run spaces;College Gallery, Book Fairs","1 - 2","","Other artist peers;Teachers / faculty;Structured applications / open calls","1","No","Yes, with full explanation","","0","0","0","0","$0"," Does legal paperwork include a gallery/loan form? ","It was not important","Family / friends;At Book Fair (add strangers?)","Book fairs","$50 - $250","Books, postcards","I did not sell any work this year","","It was somewhat important","1 - 2","Gallerists / curators","Being cold contacted by others","Studio visit question at the top seems out of order","It was not important","Never","Not sure / hard to say","1 - 3 times per month","Somewhat more","I did not pay for any promotion this year","","","","Yes and I plan to continue","Yes","Art in America;Carla;Hyperallergic;Google Images;Museums;Galleries;Instagram","","Studio in a larger studio building","About 15 by 20 feet (300 square feet)","$250 - $500","3","1 - 2 hours","No","Adjunct teaching, office work","No","2 - 5","$50,000 - $75,000","Yes","No","MFA","No","","MFA in Painting, Yale University, 2011. BA in Art, University of Wisconsin-Madison, 2006. BS in Social Welfare, University of Wisconsin-Madison, 2006. ","","$5,000 - $20,000","$200 - $300","The “advise” question is a tough one. ","Natomas, Sacramento ","Sylmar, Los Angeles ","","","It was somewhat important","6 - 10","0","1 - 2","0","","Sierra College","2","2","Generally positive","Yes but the benefits / advantages from it were unclear","Bought classroom supplies, volunteered at Mini Maker Faire","No, definitely not","","10 - 20 minutes","Yes, Somewhat","Yes, I believe so","Verge Center for the Arts, Daniel Trejo, Tom Betthauser, Open Art Assignment ","","","No","Good job!! ","Might re-word some questions in the art instructor section ","My Crocker membership, Open Art Assignment site ","Large Population / City Size;Access to High Quality Food / Restaurants;Affordability / Availability of Housing","Appropriate","Not sure / hard to say.","No"
"2019/08/10 3:10:06 PM PDT","Male","White","No","30 - 39 years old","Other artist / peer","graphite, oil paint, new age, sci fi, web art, concrete sculpture, figurative, representational, quiet","Maybe change 3-10 keywords to 5-15 and add examples like: (ie figurative, abstract, oil paint, graphite etc.)

Maybe change age to type in a number?","It was somewhat important","1 - 2","0","1 - 2","$50 - $100","Gallery spaces;Book fairs","0","","Other artist peers;Teachers / faculty","0","No","No","","0","0","0","0","$0","Maybe add “How many times was your work featured / reposted by someone else on social media this year?”

Also maybe change grant / residency wording to ask “If you did receive grants this year...” and ten add first response of “I did not receive any...”

Also could add a “How important was applying for grants or residencies for you this year?” Before all those. 
","It was somewhat important","Event attendants - book fairs","Sold work at book fairs","$0 - $50","artist books","Generally positive","","It was somewhat important","1 - 2","Gallerists / curators","Teachers / faculty","Add a “I did not sell any work this year” option to “ what kind of work did you sell this year”

Also add “art or art related items (books, prints etc)” to all questions. ","It was somewhat important","Never","About the same","1 - 3 times per month","A lot more","I did not pay for any promotion this year","","","","Yes and I plan to continue","Yes","Hyperallergic;Museums;Galleries","Maybe frontload galleries / museums etc to top of list or remove?

Also maybe remove questions about social media use the year before last?","Dedicated room / desk / area in living space","About 10 by 15 feet (150 square feet)","$0","3","2 - 5 hours","Add “mixed with my living space rent” to “how much did you pay...”","adjunct teaching, farm stand","Yes","5 - 10","$15,000 - $25,000","Yes","All good. ","MFA","Yes, full time","App Academy (programming bootcamp)","BFA in Painting, SFAI, 2010. MFA in Painting, Yale School of Art, 2012.","","$20,000 - $50,000","$200 - $300","Change advise younger self question to rate your undergraduate / graduate experiences 1-10. ","Natomas, Sacramento","Silmar, Los Angeles","","Change “top three benefits” to 3-5. And add (“don’t over think it!”)","It was somewhat important","6 - 10","0","0","1 - 2","Maybe add “(not counting book fairs)” to “how many art fairs...” maybe break out book fairs for another question. Or just make a “list the art fairs / events you attended this year” with a write in. 

Move checkbox question about what kinds of museums / galleries / events you attended this year?","College of Marin, West Valley College","1","1","Extremely poor","Yes but the benefits / advantages from it were unclear","Cleaning classroom, buying / managing supplies, managing hazardous materials","No, definitely not","Maybe change overall treatment to 1-10 scale. ","30 - 60 minutes","No, not particularly","Yes, absolutely","verge art center / studios, Sacramento library zine symposium, Sacramento Zine fest","College of Marin, SFAI Public Programs, Jack Fischer Gallery, CB1 Gallery, West Valley College","Change or delete the rate this length. Maybe to a very long, long, appropriate, short?

Get rid of “most hopeful 2020”?

Change call outs to “institutions / groups / galleries etc. “ no individual people / names. Also reword to say “that you would recommend artists avoid / treat with caution” and “seek out” respectively. 

Remove question asking about removing sections?","No","It was long but seemed worth while / felt very engaging and not as negative as I was expecting. Wouldn’t have been so long if I hadn't written so many notes in the suggestions section :) ","Maybe move up museums / galleries section closer to or before social media section?","web art, book fairs","Access to Peace / Quiet;Access to High Quality Food / Restaurants;Affordability / Availability of Housing;Proximity to Family","Too long by 1 - 10 questions","I would advise both.","Maybe add: How long will the survey take? Can I take breaks? Will the page reload?"
"2019/08/12 12:26:50 PM PDT","Male/ Two-Spirit","Chinese American","Yes","30 - 39 years old","Other artist / peer","Figurative, cultural, spiritual, large-scale, interdisciplinary","","It was somewhat important","1 - 2","1 - 2","3 - 5","$25 - $50","Artist run spaces;Museum spaces","1 - 2","3 - 5","Other artist peers;Structured applications / open calls","0","No","Yes, with full explanation","It was extremely important","0","0","1 - 2","0","$0","","It was not important","Amateur / new collectors;Online fans","I sold work directly via email","$2,500  - $5,000","Paintings","Generally positive","","It was somewhat important","1 - 2","Other artists","Cold contacting others","","It was not important","1 - 3 times per month","A lot less","1 - 3 times per month","Somewhat more","I did not pay for any promotion this year","","","","Yes and I plan to continue","Yes","Google Images","","Completely mixed up with living space","About 15 by 20 feet (300 square feet)","$501 - $750","4","2 - 5 hours","","Professor of Art, Volunteer art committee member","No","0","$50,000 - $75,000","Not sure / hard to say","","MFA","No","","MFA in Painting, Yale University, New Haven 2013. BFA in Fine Art SFAI 2010","6","$0","$0","""I don't know"" needs to be added to student loan question for priveleged kids","Anchorage, Alaska","Anchorage, AK","Diversity, wildlife, native culture, nature","","It was not important","1 - 2","0","0","0","","UAA","3","1","Generally positive","Yes but the benefits / advantages from it were unclear","Buying supplies, answering emails in summer, recommendation letters, diversity committees","Unsure","Is it important to have a clear ""full time/part time question distinction?","10 - 20 minutes","Not sure / hard to say","Not sure / hard to say","Anchorage Museum","Alaska Government","","","","","","","","",""
"2019/08/13 7:01:08 PM PDT","Female ","White ","No","30 - 39 years old","Other artist / peer","Drawing, history,  magic, astrology, mythology, altars ","No","It was somewhat important","1 - 2","0","0","$0","Art Fair ","0","Not sure / hard to say","Other artist peers","0","No","Yes, but it was not fully explained to me","It was somewhat important","1 - 2","0","3 - 5","0","$0","No","It was extremely important","Family / friends;Amateur / new collectors;Other artists","I had a studio sale","$500 - $1,000","Drawings ","Extremely positive","","It was somewhat important","1 - 2","Gallerists / curators;Other artists","Other artist peers;Direct emails messages","No","It was extremely important","Almost never","A lot less","1 - 3 times per week","Somewhat more","I did not pay for any promotion this year","","","","No but I plan to make one","No","Contemporary Art Daily;Carla;Hyperallergic;Instagram","","Completely mixed up with living space;Shared studio split with another artist / artists","A desk / table etc. (less than 80 square feet)","$250 - $500","4","2 - 5 hours","","Exhibition tech, artist ","No","10 - 20","$25,000 - $50,000","No","","Masters Degree","No","","BFA in Fine Art at CalArts, 2007. MFA in Painting and printmaking at Yale 3017","10","$50,000 - $100,000","$300 - $400","","Santa Fe, NM","Echo Park, Los Angeles CA ","Culture, walking ability to city center ","","It was not important","6 - 10","1 - 2","Not sure / don’t recall","Not sure / don’t recall","","UCSD ","1","1","Neutral / mixed","No, definitely not","","","","10 - 20 minutes","No, not particularly","Not sure / hard to say","Coaxial, Los Angeles ","","No","No","","","","","","",""
"2019/09/16 1:21:07 PM PDT","non-binary","white","Yes","30 - 39 years old","Instagram","abstract, oil paint, vivid color, altered reality, formal, texture, mixed media, sound explorations, collage. ","no","It was somewhat important","1 - 2","1 - 2","1 - 2","$0","Artist run spaces","0","3 - 5","Direct emails from a gallerist / curator;Contacts from Instagram","0","No","No","Not sure / hard to say","1 - 2","0","0","I did not apply for grants this year","I did not apply for grants this year","","It was extremely important","Family / friends;Online fans","","$0","","I did not sell any work this year","","It was somewhat important","0","Family / non-artist friends","","","It was extremely important","Almost never","A lot less","1 - 3 times per month","About the same","Not sure / don’t recall","","","","No but I plan to make one","Yes","Art in America;ARTnews;New American Paintings;New York Magazine;Instagram","","Completely mixed up with living space;Dedicated room / desk / area in living space;Studio in a larger studio building","About 10 by 15 feet (150 square feet)","$101 - $250","2","2 - 5 hours","","self-employed and part-time","Yes","more than 20","$1 - $5,000","Yes","","BFA","No","","BFA, San Francisco Art Institutie 2014","7","$20,000 - $50,000","$300 - $400","","Berkeley","Eagle Rock, LA","good weather, close to friends, space for garden and painting","what aren't the benefits of where you live? ","It was somewhat important","1 - 2","0","Not sure / don’t recall","Not sure / don’t recall","","","","","","","","","","1 - 10 minutes","No, not particularly","Not sure / hard to say","","","","","","","","","","",""
"2019/09/16 1:47:55 PM PDT","Male","Native American ","No","18 - 29 years old","Other artist / peer","Vivid Multicolors, spiritual exploration, society views, pencil, charcoal, oil and acrylic paints,","No.","Not sure / hard to say","0","0","0","$0","","0","0","Other artist peers;Teachers / faculty;Contacts from Instagram","0","No","Not sure / don’t recall","It was somewhat important","0","I did not apply to residencies this year","0","I did not apply for grants this year","I did not apply for grants this year","No?","It was somewhat important","Family / friends","Met up with my friend after he commented online inquiring about a paint sketch I made.","$0 - $50","Paintings, sketches, t-shirts.","I did not sell any work this year","","It was not important","3 - 5","Other artists","Invited artist friends over to see my studio space.","Nope.","It was somewhat important","Never","Not sure / hard to say","1 - 3 times per week","About the same","I did not pay for any promotion this year","","","","No but I plan to make one","No","Hyperallergic;Pintrist;Reddit;Google Images;Instagram","No.","Dedicated room / desk / area in living space","About 10 by 15 feet (150 square feet)","My studio was mixed with my living space","3","1 - 2 hours","No.","Babysitting ","No","0","$0","I did not file a tax return during this past year","No","Some College","No","None.","None.","7","$0","$0","No.","Knights Bridge, Bakersfield ","Knights bridge, Bakersfield ","Safety, quiet neighborhood, ","No.","It was somewhat important","3 - 5","1 - 2","0","Not sure / don’t recall","No.","None.","","","","","","","","20 - 30 minutes","No, not particularly","Yes, I believe so","","","Not really.","No.","Very interesting survey ","","","","","",""
"2019/09/16 2:02:49 PM PDT","Nonbinary ","White","Yes","30 - 39 years old","Instagram","Portrait, surrealist, figurative, paint, ink, drawing, psychology, human psyche, bright colors, disfigured anatomy, endurance","No","It was somewhat important","1 - 2","1 - 2","3 - 5","$0","Coffee shops;Restaurants;Pop-up spaces","0","1 - 2","BFA / MFA peers;Other artist peers","0","No","No","It was not important","0","0","0","0","$0","No","It was somewhat important","Family / friends;Amateur / new collectors;Other artists;Event Attendees","Shows","$500 - $1,000","Paintings, drawings, T-shirts, custom work","Generally positive","","It was not important","1 - 2","Family / non-artist friends","Conversations at openings / receptions","No","It was not important","Almost never","A lot less","1 - 3 times per month","Somewhat more","I did not pay for any promotion this year","","","","Yes and I plan to continue","Yes","Art Forum;New York Times (Arts);The New Yorker;Instagram","No","Dedicated room / desk / area in living space","About 8 by 10 feet (80 square feet)","My studio was mixed with my living space","3","2 - 5 hours","No","Barista, freelance art, personal shopper, set painting for high school theatre ","No","10 - 20","$15,000 - $25,000","No","No","BFA","No","","BFA Painting 2010 SFAI ","9","$5,000 - $20,000","$200 - $300","No","Central Phoenix, Phoenix","Rogers Park, Chicago","Affordability, proximity to LA, international airport, local artist scene, museum, library, diversity, public art, local music scene, available space","No ","It was somewhat important","6 - 10","1 - 2","3 - 5","3 - 5","No","","","","","","Painting sets (signs, backdrops, murals) for local high school theatre ","Yes, definitely","No ","10 - 20 minutes","Not sure / hard to say","Not sure / hard to say","","","A question about material costs including money spent on outsourcing certain tasks like panel building, surface preparation, website building, or installation help. ","No","Thanks for putting this together! Would love to do it again next year to see how your results compare. Excited to see the accumulated results. ","","","","","",""
