"2019/12/01 10:43:47 AM PST","Male","White","Yes","18 - 29 years old","Other artist / peer","Interactive, sculptural, game, experimental, video game, bright, introspective, environmental issues","I would add a section to explain ones work further","It was extremely important","1 - 2","0","1 - 2","$0 - 25","Gallery spaces;Public spaces","1 - 2","1 - 2","BFA / MFA peers;Other artist peers;Teachers / faculty","1","Yes","No","It was somewhat important","0","I did not apply to residencies this year","1 - 2","1 - 2","$5,000 - $15,000","No","It was somewhat important","None","I did not","$0","","I did not sell any work this year","","It was not important","0","","","","It was extremely important","Almost never","A lot less","1 - 3 times per month","A lot more","I did not pay for any promotion this year","","","","Yes and I plan to continue","No","Instagram;Twitter","","Completely mixed up with living space;Dedicated room / desk / area in living space","A desk / table etc. (less than 80 square feet)","","4","5 - 7 hours","","Student position at my former University and then an Artist's assistant. ","No","1 - 2","$1 - $5,000","I did not file a tax return during this past year","","BFA","No","","Bachelor's in Studio Arts, University of Pittsburgh, 2019.)","9","$20,000 - $50,000","$300 - $400","","Spring Hill, Pittsburgh","Mt. Washington, Pittsburgh","Saftey, population, quietness","","It was somewhat important","3 - 5","0","1 - 2","1 - 2","","University of Pittsburgh","1","1","Generally positive","No, definitely not","Working with students in wood and metal shop, helping students use larger more complicated machinery like a CNC router.","Yes, definitely","","10 - 20 minutes","No, not particularly","I don’t believe so","","","How do you feel your art has been accepted in the artistic community. 
And also a question about works being stolen/reproduced and sold online, it would be good to see how many artists are experiencing that. ","","I'm happy there is a survey for artists in general","","","","","",""
"2019/12/01 11:52:54 AM PST","Non-Binary","White (Jewish)","Yes","18 - 29 years old","Facebook","Social Justice, Trangender Rights, Mental Health, Processing, Color Theory, Harmony, Confrontational, Healing, Figurative, Memory, Abstraction, Transient","","It was somewhat important","3 - 5","1 - 2","3 - 5","$25 - $50","Artist run spaces;Coffee shops;Pop-up spaces","0","3 - 5","Other artist peers;Structured applications / open calls;Direct emails from a gallerist / curator","0","No","No","It was somewhat important","3 - 5","1 - 2","1 - 2","0","$0","","It was somewhat important","Family / friends;Other artists;Event Attendees","I sold work directly via email;I sold work directly at events","$1,000 - $2,500","Paintings, Handbound books, prints, ","Generally positive","Etsy","It was not important","0","","","","It was extremely important","1 - 3 times per month","Somewhat less","1 - 3 times per month","Somewhat more","I did not pay for any promotion this year","","","","Yes and I plan to continue","Yes","Art Forum;ARTnews;Hyperallergic;LA Times (Arts & Culture);New York Times (Arts);New York Magazine;The New Yorker;Google Images;Instagram;Facebook;Twitter","","Shared studio split with another artist / artists","About 8 by 10 feet (80 square feet)","$101 - $250","2","2 - 5 hours","","Full-time Employment as a Museum Professional (same job for 4 years)","No","0","$25,000 - $50,000","No","","Bachelors Degree","No","","BA Art Studio and Art History, UC Davis 2015","8","$0","$0","Maybe something about socioeconomic class?","North Oak Park, Sacramento","Midtown, Sacramento "," diverse population, ~affordability, safety, good weather, proximity to Bay Area (art center), new up and coming art scene meaning more opportunities to get into the art scene/shows/etc.","","It was somewhat important","11 - 25","0","0","0","","Im a museum educator at UC Davis' art museum","","","","","","","","10 - 20 minutes","Yes, Somewhat","Not sure / hard to say","Smart Museum of Art, Chicago IL. Manetti Shrem Museum, Davis CA.","John Natsoulas Gallery, Davis CA","","","","","","","","",""
"2019/12/01 12:14:04 PM PST","female","white","No","30 - 39 years old","Facebook","animation, abstract, grotesque, bold, sculpture","no","It was somewhat important","1 - 2","0","1 - 2","$0 - 25","Gallery spaces;Artist run spaces","0","1 - 2","Structured applications / open calls","0","No","No","Not sure / hard to say","1 - 2","0","0","I did not apply for grants this year","I did not apply for grants this year","no","It was not important","","","$0","","","","Not sure / hard to say","1 - 2","Gallerists / curators;Other artists","Conversations at openings / receptions","no","It was somewhat important","1 - 3 times per year","A lot less","1 - 3 times per year","A lot less","I did not pay for any promotion this year","","","","Yes and I plan to continue","Yes","Brooklyn Rail;Contemporary Art Daily;Carla;Hyperallergic;SFAQ / NYAQ / LXAQ;Instagram","no","Studio in a larger studio building;Private studio space","About 8 by 10 feet (80 square feet)","$250 - $500","1","5 - 7 hours","","teacher","No","0","$50,000 - $75,000","No","","MFA","No","","BA in Art Practice UC Berkeley 2012, MFA in Art UC Davis 2014","8","$0","","","Berkeley","Berkeley","good weather, safety, access to public transportation ","","It was somewhat important","3 - 5","0","0","3 - 5","","I am a middle school teacher ","","","","Yes and and the benefits / advantages were clear","","","","1 - 10 minutes","Not sure / hard to say","Not sure / hard to say","Aggregate Space Gallery ","","","","","","","","","",""
"2019/12/01 12:56:50 PM PST","Female ","Multi racial - Asian Latina ","No","30 - 39 years old","Facebook"," paint, colorful, conceptual, contemporary, hope ","No","It was extremely important","1 - 2","3 - 5","More than 25","$100 - $250","Gallery spaces;Artist run spaces;Pop-up spaces;Museum spaces","3 - 5","25 or more","BFA / MFA peers;Other artist peers;Structured applications / open calls;Direct emails from a gallerist / curator;Contacts from Facebook;Contacts from Instagram","0","No","Yes, with full explanation","It was somewhat important","1 - 2","0","1 - 2","1 - 2","$500 - $5,000","","It was not important","Family / friends;Former / current faculty;Established / experienced collectors;Amateur / new collectors;Event Attendees","I sold work through galleries;I sold work directly via email;I sold work directly via Facebook;I sold work directly via Instagram","$2,500  - $5,000","Paintings","Extremely positive","","It was not important","1 - 2","Gallerists / curators;Other artists","Conversations at openings / receptions;Being cold contacted by others;Direct messages on Instagram","","It was extremely important","1 - 3 times per week","About the same","1 - 3 times per week","About the same","I did not pay for any promotion this year","","","","Yes and I plan to continue","Yes","Art in America;ARTnews;Carla;Hyperallergic;LA Times (Arts & Culture);New York Times (Arts);New American Paintings;Google Images;Instagram;Facebook","","Dedicated room / desk / area in living space","About 10 by 15 feet (150 square feet)","My studio was mixed with my living space","3","10 hours or more","","Professor","No","2 - 5","$50,000 - $75,000","No","","MFA","No","","","10","$0","$0","","Sacramento, CA","Goleta, CA","Affordability ","","It was extremely important","More than 50","0","0","0","","","3","1","Generally positive","Yes and and the benefits / advantages were clear","","","","1 - 10 minutes","Yes, absolutely","I don’t believe so","Painting & Sculpture Outpost, Marysville CA; Richmond Art Center, Richmond CA; Maturango Museum, Ridgecrest CA; Verge Center for the Arts, Sacramento CA; Jay Jay Gallery, Sacramento CA; Leimin Space, Los Angeles CA; Charlie James, Los Angeles CA ","","","","","","","","","",""
"2019/12/01 1:15:40 PM PST","Female","White","No","40 - 49 years old","Facebook","Interdisciplinary, colorful, often non-objective, patterned, conceptual ","No","It was somewhat important","3 - 5","1 - 2","3 - 5","$50 - $100","Gallery spaces;Artist run spaces","1 - 2","Not sure / hard to say","Other artist peers;Structured applications / open calls","1","No","No","It was not important","1 - 2","0","0","I did not apply for grants this year","I did not apply for grants this year","No","It was somewhat important","Established / experienced collectors;Other artists","I sold work through galleries;Fundraising auction ","$2,500  - $5,000","Paintings","Generally positive","No","It was not important","25 or more","Family / non-artist friends;Established / experienced collectors;Amateur / new collectors;Other artists;Open studios, general public, students","Conversations at openings / receptions;Other artist peers;Direct messages on Facebook;Participating in formal city wise studio tour ","No","It was somewhat important","Almost never","About the same","1 - 3 times per month","A lot more","I did not pay for any promotion this year","","","","Yes and I plan to continue","No","Art in America;Art Forum;ARTnews;Art F City;Frieze Magazine;Hyperallergic;Hi-Fructose;New York Times (Arts);New York Magazine;The New Yorker;Pintrist;SFAQ / NYAQ / LXAQ;Instagram;Facebook;Juxtapoz","No","Studio in a larger studio building","About 15 by 20 feet (300 square feet)","$250 - $500","3","2 - 5 hours","No","Teaching art, community college ","No","0","$75,000 - $100,000","Yes","No","MFA","No","","BFA, California College of the Arts, MFA, School of Visual Arts","9","$100,000 - $200,000","more than $500","How long have you been paying in your student loans? Forever. Infinity. ","Sacramento (South Oak Park) ","Sacramento (South Oak Park) ","Affordable, diverse, fairly liberal, “2 hours to anywhere”, plenty of arts despite lack of much in the way  infrastructure or collector base. ","No","It was extremely important","25 - 50","1 - 2","1 - 2","1 - 2","Did you travel more than 100 miles for purposes of viewing art? Yes, often, and sometimes  much farther","Sacramento City College ","3","1","Generally positive","Yes and and the benefits / advantages were clear","Art department chair, lots of meetings, lots of committee work ","I don't believe so","No ","20 - 30 minutes","Not sure / hard to say","Not sure / hard to say","Verge Center for the Arts, Axis Gallery, Sol Collective, ArtSpace 1616","","No","No","No, thank you for collecting data","","","","","",""
"2019/12/01 5:46:51 PM PST","Female","White","Yes","18 - 29 years old","Other artist / peer","Graphite portraits, figurative, abstract watercolor, oil painting, tattoo","","It was somewhat important","0","0","0","$0","","0","3 - 5","","0","No","No","Not sure / hard to say","0","I did not apply to residencies this year","0","I did not apply for grants this year","I did not apply for grants this year","","It was somewhat important","Family / friends","I sold work directly via Instagram","$250 - $500","Paintings, t-shirts","Extremely positive","","It was somewhat important","10 - 25","Family / non-artist friends;Other artists","Other artist peers","","It was extremely important","1 - 3 times per year","About the same","1 - 3 times per week","Somewhat more","I paid for promotion and noticed some measurable positive impact","","","","Yes and I plan to continue","Yes","Instagram","","Completely mixed up with living space;Dedicated room / desk / area in living space","About 10 by 15 feet (150 square feet)","My studio was mixed with my living space","1","5 - 7 hours","","Pastry chef, restaurant work","Yes","0","$15,000 - $25,000","No","","BFA","No","","BFA San Francisco State University 2013","6","$0","$0","","Mile End, Montreal ","Little Italy, Montreal","Diversity, affordable, creative","","It was somewhat important","6 - 10","0","Not sure / don’t recall","Not sure / don’t recall","","","","","","","","","","10 - 20 minutes","No, not particularly","Not sure / hard to say","","","","The beginning questions only ask about the past year. I would also ask for the past 2 or 3 years","","","","","","",""
"2019/12/01 9:59:59 PM PST","Male","White/Latin mix ","No","30 - 39 years old","Other artist / peer","Performance, photography ","","It was not important","0","0","0","$0","","0","0","","0","No","No","It was not important","0","I did not apply to residencies this year","0","0","$0","","It was not important","","","$0","","I did not sell any work this year","","It was not important","0","","","","It was somewhat important","Never","A lot less","Never","Somewhat less","I did not pay for any promotion this year","","","","Yes and I plan to continue","Yes","Reddit;Instagram;Facebook","","Completely mixed up with living space","About 10 by 15 feet (150 square feet)","My studio was mixed with my living space","1","2 - 5 hours","","Marketing/advertising ","Yes","more than 20","$75,000 - $100,000","No","","MFA","No","","BFA, Photography, SFAI, 2009. MFA, New media, UCSB, 2013.","8","$50,000 - $100,000","$200 - $300","","Seattle, WA","Sacramento, CA","Safety, good food, opportunity ","","It was not important","1 - 2","0","Not sure / don’t recall","Not sure / don’t recall","","","","","","","","","","10 - 20 minutes","No, not particularly","Yes, absolutely","","","","","","","","","","",""
"2019/12/03 7:09:05 AM PST","Female","White","No","18 - 29 years old","Other artist / peer","Interdisciplinary, social issues, story telling, painting, textile.","No","It was somewhat important","3 - 5","0","6 - 10","$100 - $250","Gallery spaces;Artist run spaces;Museum spaces","1 - 2","3 - 5","BFA / MFA peers;Other artist peers;Structured applications / open calls;Contacts from Instagram","0","No","Yes, with full explanation","It was somewhat important","3 - 5","1 - 2","0","I did not apply for grants this year","I did not apply for grants this year","","It was somewhat important","Family / friends;Other artists;Online fans","I sold work directly via Instagram","$500 - $1,000","Paintings","","","It was somewhat important","5 - 10","Other artists","Teachers / faculty","My studio visits were due to being in an MFA program, no way to indicate that.","It was somewhat important","Almost never","A lot less","1 - 3 times per week","Somewhat more","I did not pay for any promotion this year","","","","Yes and I plan to continue","Yes","Brooklyn Rail;Hyperallergic;LA Times (Arts & Culture);New American Paintings;Instagram","","Completely mixed up with living space;Space provided by a school / residency etc.","Not sure / hard to say","My studio was mixed with my living space","4","5 - 7 hours","","While in my MFA program: Associate Instructor and Visiting Artist Lecture Series Coordinator. Since completing my MFA: Barista, Frontline Representative at an Art Museum, Gallery Invigilator, and Artist Assistant.","No","10 - 20","$25,000 - $50,000","No","","MFA","No","","BFA in Painting RISD 2016, MA in Art Education RISD 2017, MFA in Art Studio UC Davis 2019.","7","$20,000 - $50,000","$300 - $400","","Echo Park, Los Angeles CA","East Side, Providence RI","Lots of artists","","It was somewhat important","11 - 25","0","Not sure / don’t recall","Not sure / don’t recall","","UC Davis","1","1","Generally positive","Yes and and the benefits / advantages were clear","","Unsure","","10 - 20 minutes","Yes, Somewhat","I don’t believe so","","","","","","","","","","",""
"2019/12/03 4:02:53 PM PST","female","white","No","30 - 39 years old","Other artist / peer","representational, figurative, botanical, landscape, portrait, realist, classical realism, still life, tonalism, oil painting, drawing, graphite, charcoal, gouache, watercolor, works on paper","no","It was extremely important","3 - 5","0","3 - 5","$100 - $250","Gallery spaces;Artist run spaces;Outdoor spaces;Museum spaces;State Fair","1 - 2","1 - 2","Other artist peers;Structured applications / open calls;Direct emails from a gallerist / curator","1","Yes","Yes, with full explanation","It was somewhat important","0","0","1 - 2","1 - 2","$500 - $5,000","no","It was extremely important","Family / friends;Gallerists / curators;Other artists","I sold work through galleries;directly through phone calls","$1,000 - $2,500","paintings, drawings","Extremely positive","","It was somewhat important","5 - 10","Family / non-artist friends;Other artists","Other artist peers","no","It was somewhat important","1 - 3 times per year","Somewhat less","1 - 3 times per week","Somewhat more","I did not pay for any promotion this year","","","","Yes and I plan to continue","Yes","Hyperallergic;Google Images;Instagram;Facebook","no","Dedicated room / desk / area in living space","About 10 by 15 feet (150 square feet)","$501 - $750","3","2 - 5 hours","no","teaching art, painting demonstrations","No","0","$5,000 - $15,000","Yes","no","Some College","No","","","8","$0","$0","","Milo-Grogan, Columbus OH","Old North, Columbus OH","diverse population, affordability, arts opportunities, arts funding","","It was somewhat important","11 - 25","0","1 - 2","1 - 2","","","","","","","","","Did you teach anywhere outside of the college/university level?","10 - 20 minutes","Not sure / hard to say","Not sure / hard to say","","","","","This is very cool, and I'm happy to take part in it!","","","","","",""
"2019/12/04 10:11:31 AM PST","F","Iranian ","No","30 - 39 years old","Other artist / peer","Ink graphite stitching figurative political questions ","No","It was extremely important","1 - 2","0","6 - 10","$100 - $250","Gallery spaces;Artist run spaces;Public spaces","0","1 - 2","Other artist peers;Teachers / faculty;Direct emails from a gallerist / curator","0","No","No","It was extremely important","0","0","1 - 2","0","$0","","It was somewhat important","Family / friends","I sold work directly via studio visits","","🤢","Generally positive","No","It was extremely important","3 - 5","BFA / MFA peers;Other artists","BFA / MFA peers;Other artist peers;Teachers / faculty","","It was somewhat important","Never","A lot less","Almost never","Somewhat more","I did not pay for any promotion this year","","","","No but I plan to make one","No","Art in America;Art Forum;Contemporary Art Daily;Hi-Fructose;New York Times (Arts);The New Yorker;Google Images;Instagram","","Dedicated room / desk / area in living space","About 10 by 15 feet (150 square feet)","$0","5","2 - 5 hours","","Teaching","No","5 - 10","$15,000 - $25,000","No","","BFA","No","","","6","$50,000 - $100,000","$400 - $500","","","Columbus oh","","","It was somewhat important","3 - 5","0","1 - 2","1 - 2","","","4","4","Neutral / mixed","No, definitely not","","","","20 - 30 minutes","No, not particularly","Yes, I believe so","Columbus Cultural arts center ","","","","","","","","","",""
"2019/12/11 9:37:31 AM PST","female ","white","No","18 - 29 years old","Email","research, photo, drawing, ethnography, painting, interdisciplinary ","","It was somewhat important","1 - 2","0","1 - 2","$25 - $50","Artist run spaces;Public spaces;Library ","0","0","Other artist peers","1","No","No","It was somewhat important","1 - 2","I did not apply to residencies this year","0","I did not apply for grants this year","I did not apply for grants this year","","It was not important","Family / friends","","$0 - $50","textile ","I did not sell any work this year","","It was somewhat important","5 - 10","Family / non-artist friends;BFA / MFA peers;Other artists","BFA / MFA peers;Other artist peers;Teachers / faculty","","It was not important","1 - 3 times per year","A lot less","1 - 3 times per year","About the same","I did not pay for any promotion this year","","","","Yes and I plan to continue","Yes","Art Forum;ARTnews;Brooklyn Rail;Hyperallergic;New York Magazine;The New Yorker;Google Images;Instagram","","Dedicated room / desk / area in living space;Space provided by a school / residency etc.","About 10 by 15 feet (150 square feet)","$0","5","2 - 5 hours","","Museum preparator, office assistant, graduate teaching associate ","No","1 - 2","$25,000 - $50,000","No","","MFA","Yes, full time","","","7","$0","$0","","Columbus, Ohio ","Chicago, IL ","affordability, good community ","","It was extremely important","6 - 10","1 - 2","1 - 2","1 - 2","","","","","Neutral / mixed","No, definitely not","","","","1 - 10 minutes","Yes, Somewhat","Not sure / hard to say","","","","","","","","","","",""
"2019/12/12 6:17:56 PM PST","Male","Mixed","No","30 - 39 years old","Other artist / peer","Pluralism, spiritual, relational aesthetics, mixed media, conceptual","No","It was somewhat important","1 - 2","0","3 - 5","$0 - 25","Gallery spaces;Artist run spaces","1 - 2","1 - 2","Open call on Ig","0","No","Yes, with full explanation","It was not important","0","","1 - 2","0","$0","No","It was somewhat important","Family / friends;Online fans","I sold work directly via Instagram","$250 - $500","Painting, Drawing and lithograph","Generally positive","","It was not important","1 - 2","BFA / MFA peers;Former / current faculty","Teachers / faculty;Direct messages on Instagram","No","It was somewhat important","Never","Somewhat less","1 - 3 times per week","Somewhat more","I did not pay for any promotion this year","","","","No and I have no plans to do so","No","New York Times (Arts);Google Images;Instagram","","Completely mixed up with living space","About 10 by 15 feet (150 square feet)","$501 - $750","5","2 - 5 hours","No","Art instructor, studio assistant, art competition judge","No","0","$15,000 - $25,000","No","No","MFA","No","","BFA, Cooper Union, 2010. MFA in Painting, Yale, 2012.","10","$0","$0","No ","Beonx, New York","Bronx, New York","Location, affordability, community","No","It was somewhat important","3 - 5","0","0","0","No","Ashcan Studio of Art","4","2","Neutral / mixed","No, definitely not","None","","No","10 - 20 minutes","Yes, Somewhat","I don’t believe so","","","No","None specifically, but I'd be curious of it becoming more in depth, maybe about art itself or other related issues.","None, thanks ","","","","","",""
"2019/12/13 4:13:55 PM PST","nonbinary","Polish","Yes","30 - 39 years old","Instagram","paper, Polish, colorful, folk art, scissors","no","It was somewhat important","1 - 2","0","1 - 2","$25 - $50","Gallery spaces;Public spaces","6 - 10","25 or more","Structured applications / open calls;Guild of American Papercutters, of which I am a member","2","No","Yes, with full explanation","It was not important","0","I did not apply to residencies this year","0","I did not apply for grants this year","I did not apply for grants this year","","It was extremely important","Family / friends;Established / experienced collectors;Amateur / new collectors;Other artists;Online fans;Event Attendees","I sold work directly via Facebook;I sold work directly via Instagram;My online store, in-person events","$2,500  - $5,000","original papercuttings, prints, t-shirts, tote bags, handmade bookmarks, cards, stickers, pins, handmade ornaments, magnets","Generally positive","Etsy;SquareUp","It was not important","0","","","","It was extremely important","1 - 3 times per day","About the same","1 - 3 times per day","Somewhat more","I did not pay for any promotion this year","","","","Yes and I plan to continue","No","Google Images;Instagram;Facebook","","Dedicated room / desk / area in living space","About 15 by 20 feet (300 square feet)","$0","5","7 - 10 hours","","retail, community organizing, teaching art, social media management, musician","Yes","2 - 5","$5,000 - $15,000","Yes","","Some Art School","No","","","5","$0","$100 - $200","","rural Elton, Louisiana","Cannonball, Standing Rock Reservation, ND","affordability","","It was not important","0","0","0","0","","","","","","No, definitely not","","","","1 - 10 minutes","Yes, absolutely","Not sure / hard to say","","","","","","","","","","",""
