"2019/12/24 4:10:19 AM PST","Refuse to answer","Refuse to answer","Yes","40 - 49 years old","Instagram","Space, Watercolour, ink, fantasy, science fiction, night, alien, ","","It was not important","0","0","0","$0","","0","6 - 10","","0","No","No","It was not important","0","0","0","0","$0","","It was somewhat important","Family / friends;Established / experienced collectors;Amateur / new collectors;Other artists;Online fans","I sold work directly via Facebook;I sold work directly via Instagram","$50 - $250","Paintings, drawings, stickers, magnets, buttons","Extremely positive","","It was not important","0","","","","It was somewhat important","1 - 3 times per week","Somewhat less","1 - 3 times per week","Somewhat less","I paid for promotion but noticed little / no positive impact","5","","Algorithms","Yes and I plan to continue","No","Google Images;Instagram;Facebook","","Completely mixed up with living space","A desk / table etc. (less than 80 square feet)","My studio was mixed with my living space","Less than one day per week","7 - 10 hours","","Artist's assistant","Yes","2 - 5","$15,000 - $25,000","No","","Bachelors Degree","No","","BS in Theatre, Towson University, 1999","7","$20,000 - $50,000","$0","","Madison, Brooklyn, NYC","Madison, Brooklyn, NYC","Affordable, diverse, good schools, safe, convenient to train,","","It was somewhat important","0","1 - 2","Not sure / don’t recall","Not sure / don’t recall","","","","","","","","","","1 - 10 minutes","No, not particularly","Not sure / hard to say","","","","","","","","","","",""
"2019/12/24 6:01:34 AM PST","Male","African American","No","18 - 29 years old","Instagram","Depth, love, abstract, unique, design","No","It was not important","1 - 2","0","0","$0","Artist run spaces;Pop-up spaces;Outdoor spaces","0","3 - 5","Structured applications / open calls","1","No","No","It was not important","0","I did not apply to residencies this year","0","I did not apply for grants this year","I did not apply for grants this year","No","It was somewhat important","Amateur / new collectors","I sold work directly via Instagram","$0 - $50","Clothes, designs, and paintings","Neutral / mixed","","It was not important","3 - 5","Other artists","Conversations at openings / receptions;Other artist peers;Direct messages on Instagram","No","It was somewhat important","Never","","1 - 3 times per year","Somewhat more","I did not pay for any promotion this year","3","Comments, photo sharing","Referencing","No but I plan to make one","No","Google Images;Instagram;Twitter","No","Shared studio split with another artist / artists;Studio in a larger studio building;Space provided by a school / residency etc.","Not sure / hard to say","$0","5","5 - 7 hours","No","
Unrelated to art","No","more than 20","$1 - $5,000","No","No","Associates Degree","No","","NOCCA 2014","6","$0","$0","No","New Orleans, Louisiana","East","","The one right before this one","It was extremely important","6 - 10","1 - 2","3 - 5","1 - 2","No","Tulane, Material Institute","4","2","Neutral / mixed","No, definitely not","Exhibition","I don't believe so","No","1 - 10 minutes","Yes, Somewhat","Yes, absolutely","","Material Institute","No","No","Helpful","","","","","",""
"2019/12/24 7:42:22 AM PST","Female","Unknown","Yes","18 - 29 years old","Instagram","Classical, baroque, pop, neon, drama","","It was not important","1 - 2","0","0","$0 - 25","Public spaces;Museum spaces","0","3 - 5","Other artist peers","3","No","No","It was not important","0","I did not apply to residencies this year","0","I did not apply for grants this year","I did not apply for grants this year","","It was somewhat important","Family / friends;Amateur / new collectors;Other artists;Event Attendees","I sold work directly via Facebook;I sold work directly via Instagram;In person shows","$500 - $1,000","Paintings","Extremely positive","","It was not important","0","","","","It was somewhat important","1 - 3 times per year","A lot less","1 - 3 times per month","Somewhat more","I did not pay for any promotion this year","1","It did nothing and was a waste of time","I have no reach no matter what hashtags I use.","Yes and I plan to continue","No","Art Forum;ARTnews;Contemporary Art Daily;Hyperallergic;Reddit;Google Images;Instagram;Discord art groups","","Dedicated room / desk / area in living space","A desk / table etc. (less than 80 square feet)","My studio was mixed with my living space","4","2 - 5 hours","","Museum attendant, secretary, photographer","No","2 - 5","$15,000 - $25,000","Not sure / hard to say","","Bachelors Degree","Yes, full time","Juniata College","","8","$20,000 - $50,000","$0","","Rural","Rural","","","It was extremely important","11 - 25","3 - 5","0","0","","","","","","","","","","1 - 10 minutes","Yes, Somewhat","I don’t believe so","Gristle Gallery, Revolution Gallery","Copyright of the phrase “Inktober”","","","Not everyone lives in a neighborhood and city","","","","","",""
"2019/12/24 8:03:15 AM PST","Female","Caucasian ","Yes","Under 18","Instagram","Colorful, underdeveloped, portraiture, styleless, social issues, watercolors","No","It was not important","0","0","0","$0","","0","0","","0","No","No","It was not important","0","I did not apply to residencies this year","0","I did not apply for grants this year","I did not apply for grants this year","","Not sure / hard to say","","","$0","","","","It was not important","0","","","","It was not important","Never","About the same","1 - 3 times per month","Not sure / hard to say","I did not pay for any promotion this year","3","","","No and I have no plans to do so","No","Art in America;Reddit;Google Images;Instagram;Twitter","","Dedicated room / desk / area in living space","A desk / table etc. (less than 80 square feet)","My studio was mixed with my living space","7","5 - 7 hours","","TNT Fireworks","No","0","$1 - $5,000","I did not file a tax return during this past year","","Did not / have not yet completed High School","Yes, full time","Massey Hill Classical High School","","4","$0","$0","","Massey Hill, Fayetteville, North Carolina","Renee’s Lane, Raeford, North Carolina","School distance, city distance","","It was not important","0","0","0","0","","","","","","","","","","1 - 10 minutes","No, not particularly","Not sure / hard to say","","","","","","","","","","",""
"2019/12/24 8:31:53 AM PST","Female","Caucasian","Prefer not to say","60 - 69 years old","Instagram","figurative, mixed-media, characters, narrative, motion, graphic, story, relationships, mature","No","It was extremely important","1 - 2","1 - 2","More than 25","$50 - $100","Gallery spaces;Beauty salons","0","0","Cold contacting galleries / spaces","0","No","Yes, but it was not fully explained to me","It was extremely important","1 - 2","0","1 - 2","0","$0","How many jurors of juried shows and competitions did you personally know? ","It was extremely important","Family / friends;Event Attendees;People I do not know who saw work on exhibit","I sold work through galleries;Etsy","$250 - $500","Mixed media paintings/prints","Generally positive","Etsy","It was somewhat important","0","","","","It was extremely important","Never","About the same","1 - 3 times per day","Somewhat more","I did not pay for any promotion this year","2","Things looked good but otherwise, the favoritism and nepotism baked into the algorithm now used by FB vs. the original Insta algo has almost ruined me","Favoritism and nepotism - bigshots posting their lover’s kids’ work or their current lover’s or crush’s work thus instantly lending favor towards that artist vs. actual quality and originality of work bubbling up from strangers getting a chance to actually view the work without that influence.","Yes and I plan to continue","Yes","Art in America;Art Forum;ARTnews;LA Times (Arts & Culture);New York Magazine;The New Yorker;Google Images;Twitter;Artists that I do not personally know whose work I like","","Completely mixed up with living space;Dedicated room / desk / area in living space;Private studio space","About 8 by 10 feet (80 square feet)","Not sure / hard to say","7","10 hours or more","","teaching","No","more than 20","$5,000 - $15,000","No","","MFA","No","","BFA, Calarts 1975, MFA CalArts 2008","8","$0","","","Albany CA","Albany CA","Walkability","","It was somewhat important","0","0","Not sure / don’t recall","Not sure / don’t recall","","St. Mary’s College of California","1","2","","No, definitely not","Administrative and clerical shit","No, definitely not","","10 - 20 minutes","No, absolutely not","Yes, absolutely","","Too many to list but as an actual ART advisor to one city council, the way city’s select art and art projects is definitely harming artists. Selection is made arbitrarily by city council advisory members who know absolutely 0 about art and make choices based on only what appeals to them personally which leads to inherent bias and just plain stupidity. Comments are made about work during these sessions which are completely irrelevant and the type of ignorance I encounter teaching art to naive 9 year olds. As a result, artists and imagery is selected which is not well rendered, irrelevant or staid, and people stay or get dumb and dumber and I see more mediocrity and ignorance in art and culture of which art is an expression.","For those who served as jurists, how much did racialized guilt play in your decision making criteria and process","","I want to see more attention paid to the role guilt and preconceived notions plays in the selection of art at all - ex., if one is over 60, it is often assumed the individual has had their opportunity and thus their work is dismissed and younger artists are emphasized. The assumption completely ignores women who may have been the sole provider for a family and thus unable to even begin to participate in opportunities, etc. Guilt plays a part in the tendencies seen of white people who make decisions based more in their own self-centered effort to relieve feelings of personal guilt vs. actual concern and desire to help under-represented groups of artists the result of which is more mediocrity and dumbed down art and literature and artists of color being patronized. Questioning jurists and art directors to suss this out should be emphasized.","","","","","",""
"2019/12/24 12:43:14 PM PST","Female","White","No","18 - 29 years old","Instagram","Printmaking, drawing, nature, organic forms","","It was not important","0","0","0","$0","","0","Not sure / hard to say","","0","No","No","It was not important","0","I did not apply to residencies this year","0","I did not apply for grants this year","I did not apply for grants this year","","It was somewhat important","Online fans","Etsy","$0 - $50","Prints, drawings","Generally poor","Etsy","It was not important","0","","","","It was extremely important","Never","Not sure / hard to say","1 - 3 times per day","Somewhat more","I did not pay for any promotion this year","2","Nothing at all","the algorithms are completely rigged and other artists with larger following blatantly ripped off my work when i was struggling to make it past 200 followers. I feel incredible resentment and frustration at my continually ignored efforts. ","No and I have no plans to do so","No","Google Images;Instagram;Tumblr","","Completely mixed up with living space","A desk / table etc. (less than 80 square feet)","My studio was mixed with my living space","4","2 - 5 hours","","Grad student","No","0","$15,000 - $25,000","No","","Bachelors Degree","Yes, full time","University of Colorado Boulder","BS in biophysics ","7","$0","$0","","","","","","It was not important","0","0","Not sure / don’t recall","Not sure / don’t recall","","","","","","","","","","","No, absolutely not","","","","","The teaching and neighborhood","Would like to stress how completely soul crushing it is to try to sell art","","","","","",""
"2019/12/24 3:26:34 PM PST","non-binary","asian american","Yes","18 - 29 years old","Instagram","photography, screenprinting, abstraction, ecology, embodiment, zines, collage, poetics ","","It was somewhat important","1 - 2","0","3 - 5","$100 - $250","Gallery spaces","0","11 - 25","Structured applications / open calls;Contacts from Instagram","0","No","No","It was not important","0","I did not apply to residencies this year","0","I did not apply for grants this year","I did not apply for grants this year","","It was somewhat important","Family / friends;Other artists;Online fans","I sold work directly via Instagram","$50 - $250","screenprints, books, zines, photo prints ","Generally positive","","It was not important","0","","","","It was extremely important","Almost never","A lot less","1 - 3 times per month","Somewhat more","I paid for promotion and noticed some measurable positive impact","7","sharing posts via instagram stories, direct messaging other artists","order of posts in feed, non-linear algorithms, oversaturstion of imagery of IG, unthoughtful viewership  ","Yes and I plan to continue","Yes","Hyperallergic;Instagram","","Completely mixed up with living space","About 10 by 15 feet (150 square feet)","My studio was mixed with my living space","2","2 - 5 hours","","farm work, customer service ","No","10 - 20","$15,000 - $25,000","No","","Bachelors Degree","No","","BS in Environmental Engineering, Tufts University, 2018","7","$20,000 - $50,000","$100 - $200","","Southeast Portland, OR","Somerville, MA","Affordability, access to nature, good food, queer culture, good transportation ","","It was extremely important","11 - 25","0","1 - 2","1 - 2","","","","","","","","","","10 - 20 minutes","Yes, Somewhat","Not sure / hard to say","","Blue sky gallery, Carnation contemporary ","","","","","","","","",""
"2019/12/24 10:06:28 PM PST","Male","White","Prefer not to say","30 - 39 years old","Instagram","Abstract minimalism painting color field sound sculpture","","Not sure / hard to say","1 - 2","0","0","$0","Artist run spaces;Coffee shops;Public spaces;Outdoor spaces","0","11 - 25","Other artist peers;Contacts from Instagram","0","No","No","It was not important","0","I did not apply to residencies this year","0","I did not apply for grants this year","I did not apply for grants this year","","It was somewhat important","Family / friends;Amateur / new collectors;Other artists;Online fans;Event Attendees","I sold work directly via Instagram","$500 - $1,000","Original paintings, prints","Extremely positive","","It was not important","1 - 2","Family / non-artist friends;BFA / MFA peers;Other artists","Other artist peers;Direct messages on Instagram","","It was somewhat important","Almost never","Somewhat more","1 - 3 times per month","Somewhat less","I did not pay for any promotion this year","6","","The new algorithm ","No and I have no plans to do so","Yes","Instagram","","Completely mixed up with living space;Dedicated room / desk / area in living space;Alternative space in non-studio building","About 15 by 20 feet (300 square feet)","$0","3","5 - 7 hours","","Cook, server","No","1 - 2","$25,000 - $50,000","No","","Some Art School","No","","","1","$20,000 - $50,000","$0","","South philadelphia","Kensington, philadelphia","","","It was somewhat important","6 - 10","0","1 - 2","Not sure / don’t recall","","","","","","","","","","1 - 10 minutes","Yes, Somewhat","I don’t believe so","","","","","","","","","","",""
"2019/12/25 7:33:37 AM PST","male","white","No","50 - 59 years old","Instagram","surreal photography,social issues,sculpture ","no","It was not important","0","0","0","$0","na","0","6 - 10","na","0","No","No","It was not important","0","0","0","0","$0","if someone says 0 don't do follow up questions ","It was extremely important","Established / experienced collectors","I sold work directly via email;I sold work directly via Instagram","$2,500  - $5,000","photography ","Extremely positive","na","It was not important","0","na","na","","It was extremely important","1 - 3 times per week","A lot more","1 - 3 times per week","About the same","I paid for promotion and noticed some measurable positive impact","10","global exposure ","instagram software","No and I have no plans to do so","No","Instagram;Facebook","","Dedicated room / desk / area in living space","","My studio was mixed with my living space","7","2 - 5 hours","","no jobs","No","0","$0","No","disability benefits ","Associates Degree","No","","","3","$0","$0","","lake zurich,chicago","same","quiet ","","It was not important","0","0","Not sure / don’t recall","Not sure / don’t recall","","","","","","","","","","1 - 10 minutes","No, not particularly","Yes, absolutely","institutions serve themselves using artists as vehicles ","all of them","","","","","","","","",""
"2019/12/25 10:44:18 AM PST","Female","White","No","18 - 29 years old","Instagram","Nature, environmental science, earth tones, printmaking, biology, natural science, illustration ","Are you a full time artists/ what percentage of your income comes from art","It was somewhat important","3 - 5","3 - 5","6 - 10","$100 - $250","Gallery spaces;Artist run spaces;Coffee shops;Public spaces","3 - 5","25 or more","BFA / MFA peers;Other artist peers;Teachers / faculty;Cold contacting galleries / spaces;Structured applications / open calls;Contacts from Instagram","5 or more","No","Yes, with full explanation","It was extremely important","1 - 2","1 - 2","3 - 5","1 - 2","$500 - $5,000","","It was extremely important","Family / friends;BFA / MFA peers;Former / current faculty;Amateur / new collectors;Other artists;Online fans;Event Attendees","I sold work through galleries;I sold work directly via email;I sold work directly via Instagram;Art markets","$ 25,000 - $50,000","Murals, paintings, prints, clothing, tapestries","Generally positive","","It was not important","10 - 25","Family / non-artist friends;Other artists;Press","BFA / MFA peers;Other artist peers;Being cold contacted by others;Direct messages on Instagram","","It was extremely important","1 - 3 times per week","Somewhat less","1 - 3 times per day","About the same","I paid for promotion but noticed little / no positive impact","6","I received good feedback and return from followers I was able to reach ","For having 10,000+ followers a very small percentage see my posts, about 500 story views and 200 likes per photo ","Yes and I plan to continue","No","Pintrist;Google Images;Instagram;Facebook","","Dedicated room / desk / area in living space;Shared studio split with another artist / artists;Space provided by a school / residency etc.","About 15 by 20 feet (300 square feet)","$101 - $250","4","2 - 5 hours","","","No","1 - 2","$5,000 - $15,000","Yes","","BFA","No","","BFA printmaking from Kendall college of art and design ","7","$0","$0","Did you receive scholarships, did you pay your tuition yourself ","Creston, Grand Rapids","Eastown, Grand Rapids","Close to work, affordable rent, whole house instead of apartment ","","It was somewhat important","11 - 25","More than 10","3 - 5","1 - 2","","MSU broad art museum, ","","","","","","","Teaching outside of universities- workshops, events, demos, art centers, libraries ","10 - 20 minutes","Yes, absolutely","I don’t believe so","","Dogwood arts in Knoxville had a major miscommunication regarding covering travel expenses that caused me to loose money and time completing a project that they refused to correct and I’ve had 3 freelance clients break their contracts, 10+ very late payments from businesses ","","Perhaps just broadening questions to fit different types of working artists- fine art as well as freelance, makers/tradespeople, ect","","","","","","",""
"2019/12/25 6:07:14 PM PST","Male","Biracial","Yes","40 - 49 years old","Instagram","Figurative, narrative, expressive, water media, precious metals","No","It was somewhat important","3 - 5","0","6 - 10","$100 - $250","Gallery spaces;Public spaces;Museum spaces","1 - 2","11 - 25","Structured applications / open calls;Contacts from Instagram;Art council research","2","No","Yes, with full explanation","It was somewhat important","0","I did not apply to residencies this year","1 - 2","0","$0","No","It was somewhat important","Amateur / new collectors;Event Attendees","I sold work through galleries","$250 - $500","Painting, Lino cut print, silver point drawing ","Extremely positive","","Not sure / hard to say","0","","","Stop assuming artists can afford studios and can offer studio visits ","It was not important","Never","A lot less","1 - 3 times per month","A lot more","I did not pay for any promotion this year","4","Motivation and inspiration ","Unsolicited ads","No but I plan to make one","No","Art in America;Art Forum;ARTnews;Hi-Fructose;New American Paintings;Instagram","","Completely mixed up with living space","A desk / table etc. (less than 80 square feet)","$0","3","7 - 10 hours","","Adjunct Professor","No","2 - 5","$15,000 - $25,000","No","","Masters Degree","No","","MFA in painting, academy of art university, 2011. Arizona state university, BFA painting, 2006","9","$0","$0","","Jacksonville, North Carolina ","Decatur, Georgia ","None ","","It was extremely important","3 - 5","3 - 5","0","0","You assume there’s galleries anywhere near a location .... ","Coastal Carolina Community College ","5","1","Neutral / mixed","No, definitely not","Faculty navigator, academic advisor ","I believe so","","10 - 20 minutes","No, not particularly","Not sure / hard to say"," There are no arts in coastal North Carolina ","Onslow commission on the arts, NC arts council, NEA (for never supporting visual arts anymore) ","No","No","Reminder of how horrible my area is for art","","","","","",""
"2019/12/25 9:19:18 PM PST","Female ","Caucasian ","No","60 - 69 years old","Instagram","Realistic, contemporary, visual artist,  series, oil, mixed media, portraits, still-life, abstraction, minimalism, monochrome ","No","It was extremely important","6 - 10","1 - 2","6 - 10","$100 - $250","Gallery spaces;Public spaces;Pop-up spaces;Museum spaces","1 - 2","3 - 5","Other artist peers;Structured applications / open calls;Contacts from Facebook;Contacts from Instagram","1","Yes","Yes, with full explanation","It was extremely important","0","I did not apply to residencies this year","1 - 2","0","$0","No","It was extremely important","Amateur / new collectors;Event Attendees;Art Center store in consignment ","I sold work through galleries;I sold work directly via studio visits","$1,000 - $2,500","Paintings, mixed media clocks","Extremely positive","Saatchi Art;Etsy;Artfinder","It was extremely important","10 - 25","Family / non-artist friends;Amateur / new collectors;Other artists","Conversations at openings / receptions;Other artist peers;Cold contacting others;People come to visit the facility  I’m working in","No","It was extremely important","1 - 3 times per week","A lot more","1 - 3 times per week","A lot more","I did not pay for any promotion this year","8","Followers, likes, reposting my posts, ","","Yes and I plan to continue","Yes","Art in America;Pintrist;Google Images;Instagram;Facebook;International Artist,  fine art connoisseur ","No","Dedicated room / desk / area in living space;Private studio space","About 10 by 15 feet (150 square feet)","$101 - $250","6","2 - 5 hours","No","Assisting family business,  teaching painting ","No","0","$5,000 - $15,000","No","No","BFA","No","","BFA from Brera Academy of Art, Milan, Italy","8","$0","$0","","Miami, South Florida","Same","Weather, affordable, location, family vicinity ","","It was extremely important","More than 50","1 - 2","3 - 5","3 - 5","","Teaching oil painting to adults in a public art center","2","","Generally positive","No, definitely not","","","","20 - 30 minutes","Yes, Somewhat","Yes, I believe so","The Bennett Prize","In general I feel that institutions, museums and galleries in South Florida prioritize artists of color, Carribian and  South American artist. Definitely not enough opportunities for artists that are not among those categories.","","","","","","","","",""
"2019/12/26 7:24:18 AM PST","Cis Woman","White","No","","Instagram","Photography, writing, mysticism, banality, portrait","","It was not important","0","0","0","$0","","0","3 - 5","BFA / MFA peers;Teachers / faculty","0","No","No","It was somewhat important","0","I did not apply to residencies this year","1 - 2","0","I did not apply for grants this year","I haven't heard back about my grant application yet so maybe add an option for that","It was not important","Family / friends","Just a verbal agreement in person","$0 - $50","Stuffed animal ","Extremely positive","","It was not important","0","","","","It was somewhat important","Never","About the same","1 - 3 times per month","Somewhat less","I did not pay for any promotion this year","2","Having an online gallery space","Likes, engagement, followers, basically everything","Yes and I plan to continue","No","Art in America;Art Forum;Reddit;Instagram","","Completely mixed up with living space;Space provided by a school / residency etc.","Not sure / hard to say","My studio was mixed with my living space","I did not have a studio / work space this year","I did not have a studio / work space this year","","Retail","No","5 - 10","$1 - $5,000","No","","Some College","Yes, full time","Virginia Commonwealth University ","","9","$0","$0","","Monroe Ward, Richmond, VA","Virginia Beach, VA","Diversity, location, vibes","","It was somewhat important","3 - 5","1 - 2","Not sure / don’t recall","Not sure / don’t recall","","","1","2","Generally positive","Not sure","","No, definitely not","I am an educator in training so most of these do not apply to me","10 - 20 minutes","Yes, Somewhat","I don’t believe so","Virginia Museum of Fine Arts","","","","","","","","","",""
