"2019/12/20 8:35:29 AM PST","white","male","Prefer not to say","70 + years old","Instagram","ephemeral obsolete schizophrenia chance obscurification ","what did you name your lovers nipples?","It was not important","0","0","0","Not sure / hard to say","","0","1 - 2","","0","No","No","It was not important","0","I did not apply to residencies this year","0","I did not apply for grants this year","$0","how much money would you need ..in order to give up making art all together?","It was not important","Family / friends;Amateur / new collectors;Other artists","direct to client","$250 - $500","paintings, collages","Not sure / hard to say","","It was not important","0","","","do you have a sugar daddy? how much did he contribute?","It was not important","Never","Not sure / hard to say","Almost never","About the same","I did not pay for any promotion this year","0","it distracted me from creating - just like this fucking bullshit survey is doing right now","it makes you realize how insular & exclusive art communities are & how cheap & worthless your art actually is","Yes and I plan to continue","Yes","my nose","which body part would you sacrifice in order to assure that your target demographic will be avid consumers of your work for the remainder of their lifetime(s)?","Private studio space","About 20 by 30 feet (600 square feet)","$250 - $500","6","5 - 7 hours","do you perform onanistic rituals in your studio workspace? (aside from making art of course) ","all sorts of","No","2 - 5","$5,000 - $15,000","No","would the IRS be surprised to find out how much you make under the table at your part time job?","Some College","No","","","1","$0","","did you know that higher education is a scam to milk profit out of freely available resources by pretending like you need accreditation from your peers to officially ""understand"" them?","Corktown, Detroit","Garden District, New Orleans","Detroit is the best fucking city in the world","no","It was somewhat important","3 - 5","1 - 2","1 - 2","Not sure / don’t recall","how many galleries would it take to screw in a lightbulb?","","","","","","","","","10 - 20 minutes","No, not particularly","No, absolutely not","","instagram, facebook","","","","","","","","",""
"2019/12/20 12:14:02 PM PST","Female","White","No","60 - 69 years old","Instagram","Abstract, oil painting, mixed media, colorful, drawing, expressive, anthropomorphic, layered, organic, existential, authentic","No","It was extremely important","6 - 10","1 - 2","11 - 25","More than $250","Gallery spaces;Museum spaces;Tavern","0","0","Structured applications / open calls;Direct emails from a gallerist / curator","1","No","Yes, with full explanation","It was somewhat important","1 - 2","0","0","","$0","No","It was somewhat important","Family / friends;Established / experienced collectors","I sold work through galleries","$1,000 - $2,500","Oil painting, assemblage","Generally positive","","It was not important","3 - 5","Family / non-artist friends;Amateur / new collectors;Other artists","Other artist peers;Listing in regional brochure","No","It was somewhat important","","","1 - 3 times per week","A lot more","I did not pay for any promotion this year","7","New to IG this year. Connected with other artists. Building followers. Expanding audience. Receiving validation.","Few substantive comments (the nature of the beast)","Yes and I plan to continue","Yes","Hyperallergic;New York Times (Arts);Google Images;Instagram","No","Private studio space","About 15 by 20 feet (300 square feet)","$0","4","1 - 2 hours","No","Volunteer","No","0","$0","No","A question that covers other possible job status, i.e. having retired from a non-art career to finally paint full-time. In the art world there's an age bias and older emerging artists who haven't achieved public recognition as artists remain invisible.","Masters Degree","No","","BFA, Painting and Printmaking, VCU, 1977. MA, Art Therapy, UIC, 1985.","7","$0","","No","Lake Ann, MI (rural/natural area ""up North"")","Same","Affordable, safe, incredible natural beauty, quiet, artist community.","No","It was extremely important","11 - 25","0","0","0","","","","","","","","","","10 - 20 minutes","Not sure / hard to say","Yes, I believe so","The Oliver Art Center, Frankfort, MI","","","","","","","","","",""
"2019/12/21 12:02:26 AM PST","nonbinary","Jewish","Yes","18 - 29 years old","Instagram","form, monotone, shapes in space, technical drawing, inking, emphasis on technique","","It was not important","0","0","0","$0","","0","0","","0","No","No","It was not important","0","I did not apply to residencies this year","0","I did not apply for grants this year","I did not apply for grants this year","","It was not important","","","$0","","I did not sell any work this year","","It was not important","0","","","","It was somewhat important","Never","About the same","1 - 3 times per month","Somewhat more","I did not pay for any promotion this year","3","simple layout","non-chronological posts in feed","No but I plan to make one","No","New York Times (Arts);Instagram","","Completely mixed up with living space;Space provided by a school / residency etc.","A desk / table etc. (less than 80 square feet)","My studio was mixed with my living space","I did not have a studio / work space this year","I did not have a studio / work space this year","","none; I was a full time student","No","0","$0","I did not file a tax return during this past year","","Some College","Yes, full time","Macalester College","","9","$0","$0","","Macalester-Groveland, St Paul","Los Altos, CA","large amount of theater, affordable, urban, good public transit","","It was not important","0","1 - 2","0","0","","","","","","","","","","10 - 20 minutes","Not sure / hard to say","Not sure / hard to say","","","","","","","","","","",""
"2019/12/21 3:04:27 AM PST","M","W","No","60 - 69 years old","Instagram","Photo, light, color, landscape, luminous","N","It was somewhat important","1 - 2","0","1 - 2","$50 - $100","Gallery spaces","1 - 2","1 - 2","Other artist peers;Cold contacting galleries / spaces","0","No","No","It was not important","0","0","1 - 2","0","$0","N","It was somewhat important","Established / experienced collectors;Other artists","No sales","$0","None","I did not sell any work this year","","It was not important","0","","","Add none as an answer","It was somewhat important","Never","","1 - 3 times per month","Somewhat more","I did not pay for any promotion this year","2","","","","","","","Dedicated room / desk / area in living space","About 10 by 15 feet (150 square feet)","$0","3","2 - 5 hours","","40 hour plus photo shoots","No","","$50,000 - $75,000","No","","Associates Degree","No","","AS in Community Services, Empire State College SUNY","9","$0","","","South Buffalo,  NY","South Buffalo,  NY ","Family, location, affordability","","It was extremely important","3 - 5","3 - 5","1 - 2","0","","","","","","Yes and and the benefits / advantages were clear","","","","20 - 30 minutes","Yes, Somewhat","No, absolutely not","Gallery 360, MN","","","","Interesting, when and where are results published?","","","","","",""
"2019/12/21 4:20:56 AM PST","Male","White","Yes","18 - 29 years old","Instagram","Minimalist","","Not sure / hard to say","0","0","0","$0","","0","1 - 2","","0","No","No","Not sure / hard to say","0","I did not apply to residencies this year","0","I did not apply for grants this year","I did not apply for grants this year","","It was somewhat important","","","$0","Commissioned Designs, T-Shirts","I did not sell any work this year","","Not sure / hard to say","0","","","","It was extremely important","Never","A lot less","1 - 3 times per month","Somewhat more","I paid for promotion but noticed little / no positive impact","4","Public Likes","Follower Counts","Yes and I plan to continue","Yes","Reddit;Google Images;Instagram;Twitter","","Completely mixed up with living space","A desk / table etc. (less than 80 square feet)","My studio was mixed with my living space","5","2 - 5 hours","","Retail","No","more than 20","$1 - $5,000","No","","High School Diploma / GED","No","","","3","$0","$0","","New Brighton State Beach, Capitola","Santa Cruz","Good weather, like-minded culture","","It was not important","1 - 2","1 - 2","0","Not sure / don’t recall","","","","","","","","","","1 - 10 minutes","No, not particularly","I don’t believe so","","","","","","","","","","",""
"2019/12/21 4:33:44 PM PST","non-binary","white","Yes","Under 18","Instagram","bright color, manga, soft, penciled, mute","no","Not sure / hard to say","0","0","1 - 2","$25 - $50","","0","3 - 5","","2","No","No","Not sure / hard to say","0","0","0","I did not apply for grants this year","I did not apply for grants this year","no","It was somewhat important","Family / friends;Online fans","I sold work directly via Instagram","$0 - $50","paintings, sketches","Neutral / mixed","","Not sure / hard to say","0","","","no","It was extremely important","Never","A lot less","1 - 3 times per week","A lot more","I did not pay for any promotion this year","7","","","No and I have no plans to do so","No","Pintrist;Reddit;Instagram","","Dedicated room / desk / area in living space","A desk / table etc. (less than 80 square feet)","My studio was mixed with my living space","5","10 hours or more","no","none","No","0","$0","No","no","Did not / have not yet completed High School","Yes, full time","north county high school","","3","$0","$0","no"," baltimore, maryland","baltimore, maryland","art stores","no","It was not important","1 - 2","0","1 - 2","Not sure / don’t recall","no","","","","","","","","","1 - 10 minutes","Yes, Somewhat","Yes, I believe so","","","no","no","no","","","","","",""
"2019/12/22 4:42:49 AM PST","Male","Caucasian","No","70 + years old","Instagram","Painting, figurative, semi-abstract, realistic,, unconventional, landscape, urban, still life, colorful, dynamic","","It was extremely important","6 - 10","1 - 2","3 - 5","$100 - $250","Gallery spaces;Museum spaces;Art center","25 or more","25 or more","Structured applications / open calls;Direct emails from a gallerist / curator;Direct contact at an art center","3","Yes","Yes, with full explanation","It was somewhat important","3 - 5","0","3 - 5","0","$0","","It was extremely important","Family / friends;Established / experienced collectors;Amateur / new collectors;Online fans;Gallery clients","I sold work through galleries;I sold work directly via Facebook;I sold work directly via Instagram","$ 25,000 - $50,000","Paintings, prints","Extremely positive","","It was somewhat important","10 - 25","Family / non-artist friends;Amateur / new collectors;Other artists;My students","Conversations at openings / receptions;Phone and actual conversations","","It was extremely important","1 - 3 times per day","Somewhat more","1 - 3 times per day","Somewhat more","I did not pay for any promotion this year","7","Recognition through exposure, likes and followers","Consciousness of my work is very short on line","Yes and I plan to continue","Yes","Pintrist;Instagram;Facebook;Linkedin","","Dedicated room / desk / area in living space;Private studio space","About 20 by 30 feet (600 square feet)","$0","5","2 - 5 hours","","None","No","0","$0","Yes","","BFA","No","","BFA Pratt Institute 1972","5","$0","$0","","Sarasota, Florida Indian beach, Sarasota ","Indian Beach, Sarasota ","Diversity, wide age range, friendly, great weather, arts friendly","","It was somewhat important","6 - 10","1 - 2","3 - 5","1 - 2","","ArtCenter Manatee ","1","1","Extremely positive","No, definitely not","","","","20 - 30 minutes","Yes, Somewhat","No, absolutely not","ArtCenter Manatee ","","","How god/ bad is the Gallery system currently? And how well are galleries working for you?","","","","","","",""
"2019/12/22 9:15:21 AM PST","Biological Female","Human","No","50 - 59 years old","Instagram","Digital, traditional media, socio-political, psychoanalytical themes","","It was somewhat important","3 - 5","0","3 - 5","$25 - $50","Gallery spaces;Artist run spaces;Co-op spaces;Pop-up spaces;Open studio","1 - 2","3 - 5","Other artist peers;Direct emails from a gallerist / curator;Contacts from Facebook","3","Yes","Yes, with full explanation","It was somewhat important","1 - 2","0","1 - 2","0","$0","Ask about income outside of the conventional art norms","It was extremely important","Family / friends;Other artists;Online fans","I sold work directly via Facebook;Website, newsletter ","$500 - $1,000","Paintings, archival prints, T-shirts, calendars ","Generally positive","Am on artsy, no sales generated","It was extremely important","3 - 5","Family / non-artist friends;Amateur / new collectors;Other artists","Direct emails messages","","It was somewhat important","1 - 3 times per week","About the same","1 - 3 times per month","About the same","I paid for promotion but noticed little / no positive impact","5","Followers, likes","Event rsvp, no one in Los Angeles shows up when they say they will","Yes and I plan to continue","Yes","ARTnews;Hyperallergic;Hi-Fructose;Instagram;Facebook;Larry’s List, artsy","","Dedicated room / desk / area in living space;Other","About 10 by 15 feet (150 square feet)","My studio was mixed with my living space","7","5 - 7 hours","","Unemployed for years","No","0","$5,000 - $15,000","Yes","","Some College","No","","None","5","$0","$0","","Los Angeles ","Los Angeles ","Weather, neighbors ","Ask about gentrification killing culture snd pushing working class out","It was somewhat important","3 - 5","0","1 - 2","Not sure / don’t recall","Ask about museum visits, ask about why one does not attend gallery openings","","","","","","","","Artists do other things besides teach","10 - 20 minutes","No, absolutely not","Not sure / hard to say","Not a single one","","","","Your questions are slanted to a particular in the box type of thinking. You don’t take into account the many of us who are self taught, self educated, are forced to work outside the art biz. ","","","","","",""
"2019/12/22 10:06:28 AM PST","Male","White","No","70 + years old","Instagram","Figurative, Abstract, Landscape, Color, Line, Form, Conceptual, Contemporary, Expressive, Painterly, Intuitive, Formal, Mixed Media, Drawing, Light","No","It was somewhat important","1 - 2","0","0","$0","Gallery spaces;Museum spaces","0","3 - 5","Group Invitationals","0","Yes","No","It was not important","0","0","0","0","$0","No","It was extremely important","Established / experienced collectors","Auction Sales","$1,000 - $2,500","Paintings","Neutral / mixed","Saatchi Art;Etsy;BigCartel;Artfinder;Fine Art America, Personal Website","It was somewhat important","0","","","No","It was extremely important","1 - 3 times per month","About the same","1 - 3 times per day","About the same","I paid for promotion but noticed little / no positive impact","5","Public Likes","Facebook","Yes and I plan to continue","Yes","Brooklyn Rail;Contemporary Art Daily;Hyperallergic;Hi-Fructose;Pintrist;Google Images;Instagram","No","Private studio space","More than 20 by 30 feet (600 square feet)","","7","10 hours or more","No","No outside jobs","No","10 - 20","$0","No","No","Some College","No","n/a","n/a","5","$0","$0","No","Albuquerque, New Mexico","Albuquerque","Good weather, affordable","No","It was extremely important","0","0","1 - 2","1 - 2","No","","","","","No, definitely not","","","No","1 - 10 minutes","No, not particularly","Yes, I believe so","","","No","No","Thanks!","","","","","",""
"2019/12/22 11:00:15 AM PST","female","white","Prefer not to say","60 - 69 years old","Other artist / peer","mixed media, sculpture, water colors on japanese paper, ink on wood","no","It was extremely important","1 - 2","1 - 2","3 - 5","$0","Gallery spaces;Public spaces","1 - 2","Not sure / hard to say","Direct emails from a gallerist / curator","2","Yes","Yes, with full explanation","It was extremely important","1 - 2","0","0","I did not apply for grants this year","I did not apply for grants this year","no","","Established / experienced collectors;Gallerists / curators","I sold work through galleries;sold through collectors","more than $50,000","mixed media, japanese paper with burst pigment, scultupture","Extremely positive","squarespace","It was extremely important","25 or more","Established / experienced collectors;Gallerists / curators;Other artists","Conversations at openings / receptions;Being cold contacted by others;Direct emails messages","no","Not sure / hard to say","Never","A lot less","Never","A lot less","I did not pay for any promotion this year","0","do not use social media ","social media in any platform has become something i will not use","Yes and I plan to continue","Yes","ARTnews;Frieze Magazine;LA Times (Arts & Culture);New York Times (Arts);The New Yorker","no","Completely mixed up with living space;Dedicated room / desk / area in living space;Alternative space in non-studio building","More than 20 by 30 feet (600 square feet)","$1,001 - $2,500","7","7 - 10 hours","no","working on art only","No","0","$0","Yes","no","PhD","No","","BS Northern Arizona University , 1980, Stanford University MS , 2007, Stanford University , Phd Biology ","10","$0","$0","no","Albuququerque, New Mexico","Monterey, California","affordability, access to cultural events, good airport, temperate climate","no","It was extremely important","11 - 25","3 - 5","3 - 5","3 - 5","no","","","","","","","","","10 - 20 minutes","Yes, Somewhat","Not sure / hard to say","","","","","","","","","","",""
"2019/12/22 12:40:27 PM PST","Female","White","Yes","18 - 29 years old","Instagram","digital, bright colors, vector, graphic, photography","","It was somewhat important","1 - 2","0","0","$0","Artist run spaces;Public spaces","0","6 - 10","Other artist peers","0","No","No","It was not important","0","I did not apply to residencies this year","0","I did not apply for grants this year","I did not apply for grants this year","","It was somewhat important","Family / friends;BFA / MFA peers;Online fans;Event Attendees","events","$50 - $250","greeting cards, digital prints, stickers, t-shirts","Generally positive","RedBubble","It was not important","0","","","","It was extremely important","Never","About the same","1 - 3 times per week","Somewhat less","I paid for promotion but noticed little / no positive impact","7","","cropping","No but I plan to make one","Can't recall","New York Times (Arts);The New Yorker;Instagram;Twitter","","Completely mixed up with living space","A desk / table etc. (less than 80 square feet)","My studio was mixed with my living space","3","5 - 7 hours","","News Reporter","No","1 - 2","$0","I did not file a tax return during this past year","","Some College","Yes, full time","Illinois State University","","7","$1 - $5,000","$0","","Normal, Illinois","Mattoon, Illinois","liberalism, small businesses, art culture","","It was extremely important","1 - 2","0","0","0","","","","","","","","","","1 - 10 minutes","Yes, Somewhat","Not sure / hard to say","","","","","","","","","","",""
"2019/12/22 12:59:36 PM PST","Female","","No","50 - 59 years old","Instagram","Colour, mixed media, social concerns, spirituality, acrylic, prints, abstract","","It was extremely important","0","1 - 2","3 - 5","$50 - $100","Artist run spaces;Coffee shops;Art walks","0","Not sure / hard to say","Friends","1","No","No","It was not important","0","I did not apply to residencies this year","0","I did not apply for grants this year","I did not apply for grants this year","","It was extremely important","Event Attendees","Events","$250 - $500","Prints, pins, cards","Generally positive","","It was not important","0","","","","It was extremely important","Never","","1 - 3 times per month","Not sure / hard to say","I did not pay for any promotion this year","2","","","Yes and I plan to continue","No","Pintrist;Google Images;Instagram;Twitter","","Completely mixed up with living space","Not sure / hard to say","My studio was mixed with my living space","I did not have a studio / work space this year","I did not have a studio / work space this year","","","No","0","$100,000 - $150,000","No","","Associates Degree","No","Pcc","","5","$0","$0","","Portland oregon ","Portland oregon ","Transportation ","","It was not important","3 - 5","3 - 5","Not sure / don’t recall","Not sure / don’t recall","","","","","","","","","","10 - 20 minutes","No, not particularly","I don’t believe so","","","","","","","","","","",""
"2019/12/22 1:57:40 PM PST","Femal","Caucasian ","Yes","18 - 29 years old","Instagram","Abstract, colorful, textural, acrylic, clay","No","It was somewhat important","1 - 2","0","1 - 2","$50 - $100","Gallery spaces;Pop-up spaces","0","0","Structured applications / open calls","0","No","No","It was not important","0","I did not apply to residencies this year","0","I did not apply for grants this year","I did not apply for grants this year","No","It was somewhat important","Family / friends","I sold work directly via Instagram","$0 - $50","Ceramics","Extremely positive","","It was not important","0","","","","It was somewhat important","Never","A lot less","1 - 3 times per month","Somewhat less","I did not pay for any promotion this year","7","Feedback from a wider audience ","","Yes and I plan to continue","No","ARTnews;Google Images;Instagram","","Completely mixed up with living space;Alternative space in non-studio building","A desk / table etc. (less than 80 square feet)","My studio was mixed with my living space","4","2 - 5 hours","","Retail","No","more than 20","$5,000 - $15,000","No","","Bachelors Degree","No","","BS in Art Therapy, Indiana Wesleyan University, 2018","5","$20,000 - $50,000","$300 - $400","","Malvern, Philadelphia ","","","","Not sure / hard to say","3 - 5","0","Not sure / don’t recall","Not sure / don’t recall","","","","","","","","","","1 - 10 minutes","Not sure / hard to say","No, absolutely not","","","","","","","","","","",""
"2019/12/22 9:11:02 PM PST","Female ","White semi trash ","Yes","Under 18","Instagram","Social issues, digital, school, portraits, oils, acrylics, outlet ","","It was somewhat important","1 - 2","0","1 - 2","","Artist run spaces;Coffee shops;Schools ","0","1 - 2","Other artist peers;Teachers / faculty","2","No","No","Not sure / hard to say","0","I did not apply to residencies this year","0","0","I did not apply for grants this year","","It was somewhat important","Family / friends;Online fans","I sold work directly via Instagram","$0 - $50","Paintings, designs, digital work ","Not sure / hard to say","","It was not important","Not sure / hard to say","","","","It was extremely important","1 - 3 times per month","Somewhat less","1 - 3 times per week","A lot more","I did not pay for any promotion this year","2","Likes
","Personal issues ","No but I plan to make one","No","Instagram","","Completely mixed up with living space;Space provided by a school / residency etc.","A desk / table etc. (less than 80 square feet)","My studio was mixed with my living space","","I did not have a studio / work space this year","","General merchandise With Target ","No","1 - 2","$1 - $5,000","No","","Did not / have not yet completed High School","Yes, full time","Champlin Park Highschool ","","9","Not sure / hard to say","","","","","","","It was somewhat important","1 - 2","1 - 2","0","0","","","","","","","","","","","Yes, Somewhat","Yes, I believe so","","","","","Kinda long but helpful ","","","","","",""
"2019/12/23 5:48:38 AM PST","Female","White","Yes","18 - 29 years old","Instagram","Digital, painting, vintage, pencil, ink","No","It was somewhat important","1 - 2","0","1 - 2","$0","Gallery spaces","1 - 2","25 or more","Teachers / faculty","1","No","No","It was not important","0","I did not apply to residencies this year","0","I did not apply for grants this year","I did not apply for grants this year","No","It was extremely important","Family / friends","I sold work directly via Instagram","$50 - $250","Paintings, drawings ","Generally poor","None of these, all done in person","It was not important","Not sure / hard to say","Family / non-artist friends","","No","It was extremely important","1 - 3 times per year","Somewhat more","1 - 3 times per week","A lot more","I paid for promotion but noticed little / no positive impact","7","Posting regularly to keep audience interesting","Likes","No but I plan to make one","No","Pintrist;Reddit;Google Images;Instagram;Facebook;Twitter","No","Completely mixed up with living space;Dedicated room / desk / area in living space","About 8 by 10 feet (80 square feet)","My studio was mixed with my living space","7","10 hours or more","No","N/a","No","5 - 10","$0","No","No","Some Art School","Yes, part time","Broward College","","6","$0","$0","No","Coral springs Florida","Coral springs florida","","No","It was somewhat important","3 - 5","1 - 2","Not sure / don’t recall","Not sure / don’t recall","No","","","","","","","","","10 - 20 minutes","Yes, absolutely","Yes, I believe so","","","","","","","","","","",""
